{
  "schema_version": "agent_proposal.v1",
  "proposal_id": "proposal-tamp-task-plan-001",
  "source": "mock-pddlstream-pybullet",
  "intent": "install a guarded TAMP task plan for a fresh scene",
  "context_hash": "fnv1a64:5656565656565656",
  "slot": "task-plan",
  "fragment_contract": "guarded-task-plan.v1",
  "previous_subtree_hash": "fnv1a64:bbbbbbbbbbbbbbbb",
  "blackboard": {
    "scene_fresh": {
      "type": "bool",
      "value": true,
      "age_ms": 25
    }
  },
  "fragment": "(slot task-plan\n  :contract guarded-task-plan.v1\n  :install at-tick-boundary\n  :fallback safe-stop\n  (reactive-sel\n    (seq\n      (cond scene-fresh?)\n      (act validate-target)\n      (act execute-motion))\n    (act safe-stop)))\n"
}
