{
  "schema_version": "agent_proposal.v1",
  "proposal_id": "proposal-flagship-recovery-001",
  "source": "deterministic-template-v1",
  "intent": "recover the wheeled flagship from a collision-imminent blocked path",
  "context_hash": "fnv1a64:1212121212121212",
  "slot": "recovery-policy",
  "fragment_contract": "guarded-recovery.v1",
  "previous_subtree_hash": "fnv1a64:aaaaaaaaaaaaaaaa",
  "blackboard": {
    "blocked_path": {
      "type": "bool",
      "value": true,
      "age_ms": 25
    },
    "observation_fresh": {
      "type": "bool",
      "value": true,
      "age_ms": 25
    }
  },
  "fragment": "(slot recovery-policy\n  :contract guarded-recovery.v1\n  :install at-tick-boundary\n  :fallback safe-stop\n  (reactive-sel\n    (seq\n      (cond blocked-path?)\n      (cond observation-fresh?)\n      (plan-action\n        :name \"flagship-recovery-turn\"\n        :planner :mcts\n        :budget_ms 20\n        :work_max 64\n        :state_key recovery-state\n        :action_key recovery-action)\n      (act execute-recovery-turn)\n      (cond recovery-exit?))\n    (act safe-stop)))\n"
}
